剧情ID,剧情类型,标题,正文,选项1,选项1判定属性,选项1门槛,选项1成功文案,选项1成功效果,选项1失败文案,选项1失败效果,选项2,选项2判定属性,选项2门槛,选项2成功文案,选项2成功效果,选项2失败文案,选项2失败效果,是否侍寝
2067,日常,猫惊御驾,皇上的御猫突然受惊冲向你。,温柔安抚猫儿,心机,75,猫儿在你怀中安静下来，皇上大悦。,"心机+20;圣宠+35",猫儿抓伤了你的脸。,"容貌-40;体质-10",惊慌失措躲避,体质,60,你躲开了，猫儿冲向了皇上。,"声望-30",猫儿抓伤了圣上，你被处死。,"死亡",0
2068,死局,皇帝噩梦,皇上在半夜惊醒，拔剑乱挥，以为有刺客。,上前抱住皇上,体质,90,你的体温安抚了皇上，成了他的依赖。,"圣宠+100;体质-10",你被皇上误伤，失血过多。,"死亡",高声呼喊侍卫,心机,80,侍卫进门救驾，你亦平安。,"声望+20",皇上觉得你让他丢了面子。,"死亡",1
2069,日常,整理旧画,你在整理内库时，发现了一张皇上早年的丹青。,精心装裱献上,才情,80,皇上怀念往事，对你倍加宠爱。,"才情+20;圣宠+45",你弄坏了画轴。,"声望-30;体质-10",当做没看见收起,心机,70,你避免了被卷入旧事的麻烦。,"心机+20",你被灰尘呛得生了病。,"体质-10",0
2070,机遇,春日游船,你在湖边看风景，皇上的龙舟正好经过。,一曲长笛引龙舟,才情,85,皇上命人靠岸接你上船共游。,"才情+30;圣宠+50",你笛声凄厉，惊了圣驾。,"圣宠-30",跳入水中救人,体质,90,你救下了失足落水的太监，皇上赞你仁慈。,"声望+50;圣宠+30",你险些把自己淹死。,"体质-50;容貌-10",1
2071,博弈,新人入宫,一批更年轻的秀女入宫，抢走了不少风头。,传授宫中规矩,声望,75,你树立了威信，成了她们的领头。,"声望+30;心机+10",新人觉得你摆谱，联手排挤你。,"声望-20",暗中挑拨离间,心机,85,她们内部争斗，你坐收渔利。,"心机+40",计谋被识破，被皇上厌恶。,"圣宠-50",0
2072,日常,缝制龙袍,皇上命你为其缝制贴身的一件中衣。,绣上太极图案,才情,80,皇上赞你心思细腻，利于修行。,"才情+25;圣宠+40",你因劳累过度，视力受损。,"容貌-10;体质-10",快速保质完成,体质,70,皇上穿着舒适，赏了你不少钱。,"体质+10;声望+20",中衣领子太紧，皇上不悦。,"圣宠-20",0
2073,机遇,深夜密谈,皇上找你商量如何应对贪腐的重臣。,提供家乡传闻,心机,90,你的情报让皇上成功破案。,"心机+50;圣宠+70",情报有误，导致皇上受挫。,"死亡",劝圣上保重龙体,声望,75,皇上觉得你很窝心。,"声望+20;圣宠+30",皇上觉得你没有见识。,"声望-20",1
2074,日常,御花园观星,你在夜里观测星象，正好撞见皇上。,讲述星象吉凶,才情,85,皇上赞你有经天纬地之才。,"才情+40;圣宠+50",你言语不详，皇上觉得你故弄玄虚。,"圣宠-20",陪皇上静静看星,容貌,75,皇上被你的侧脸吸引。,"容貌+15;圣宠+35",你被蚊虫叮了一脸包。,"容貌-10",1
2075,博弈,内廷宴会,宴会上高位妃子故意让你上台助兴表演。,献上一段剑舞,体质,85,你英姿飒爽，皇上看得目不转睛。,"体质+20;圣宠+60",你长剑脱手，险些刺中圣驾。,"死亡",称病推托不去,心机,80,你躲开了被羞辱的尴尬。,"心机+25",对方在酒里下药让你当众失态。,"死亡",0
2076,日常,整理藏书,你被派去整理落满灰尘的皇家图书馆。,整理出目录分类,心机,70,你得到了主管的信任。,"心机+20;声望+10",你被书架砸伤。,"体质-20",趁机阅读孤本,才情,85,你的知识储备大增。,"才情+40",你被指控私窥御笔。,"死亡",0
2077,机遇,皇帝生辰,皇上大寿，要你献上一份特别礼物。,亲手烹制长寿面,体质,75,皇上吃出了儿时的味道，感动落泪。,"圣宠+70;声望+30",面条煮糊了。,"圣宠-20",献上一场皮影戏,才情,80,皇上觉得新奇有趣。,"才情+30;圣宠+40",皮影戏台塌了。,"声望-30",1
2078,死局,谋害皇嗣,你发现有人在皇子的摇篮里放了毒虫。,立刻上前徒手抓虫,体质,95,你救了皇子，但也身中剧毒。,"圣宠+150;声望+100",你没抓到虫，自己还被蜇死。,"死亡",寻找长辈帮忙,心机,85,你保全了自己也救了人。,"心机+30;声望+20",救援来得太慢，皇子夭折，你陪葬。,"死亡",0
2079,日常,种植牡丹,你在寝宫培育出了一朵罕见的并蒂莲。,献给皇上赏玩,声望,75,皇上以此为吉兆，大赏全宫。,"圣宠+60;声望+40",花在路上枯萎了。,"声望-20",留着自己欣赏,体质,60,你的心情变好了。,"体质+15",你被指责私藏吉兆，不思圣恩。,"圣宠-30",0
2080,机遇,月下论政,皇上正为江南水患忧心忡忡。,提出疏导之法,才情,95,皇上采纳了你的策略，万民得救。,"圣宠+120;心机+50",皇上觉得你牝鸡司晨。,"死亡",温柔依偎安慰,容貌,85,皇上在你这里得到了片刻安宁。,"圣宠+50;容貌+10",皇上觉得你没心没肺。,"圣宠-40",1
2081,日常,刺绣荷囊,你为主子绣一个非常精美的荷囊。,加入珍贵的香料,心机,75,主子佩戴后备受皇上称赞。,"心机+20;声望+15",香料引起了主子的咳嗽。,"声望-30",追求极致针法,才情,80,荷囊被收入内库。,"才情+25;声望+10",你绣坏了布料。,"体质-10",0
2082,博弈,御花园争位,你正坐着休息，一名新晋小主让你腾位置。,淡定继续坐着,声望,80,她被你的气场镇住，悻悻而归。,"声望+25;心机+10",她叫来侍卫把你强行拉开。,"声望-30;体质-10",笑着请她共坐,心机,70,你成功化敌为友。,"心机+15;声望+10",她觉得你虚伪，吐了你一身。,"容貌-10",0
2083,机遇,秋日围猎,皇上带你去郊外围猎，命你射一箭看看。,正中红心靶心,体质,90,皇上赞你巾帼不让须眉。,"圣宠+60;体质+20",箭偏得差点射中皇上的坐骑。,"圣宠-50",表示害怕不敢射,容貌,75,皇上亲手从背后教你射箭。,"圣宠+50;容貌+10",皇上觉得你矫揉造作。,"圣宠-20",1
2084,日常,整理档案,你在档案室发现了一些妃子的进宫记录。,偷偷记下她们的生辰,心机,85,你掌握了送礼的先机。,"心机+30",你被管理员抓住。,"声望-20",将其归位不看,声望,70,你保持了正直的声誉。,"声望+15",你错过了一个大秘密。,"心机-10",0
2085,死局,毒茶风波,皇上让你给某位重臣送茶，你发现茶里有毒。,当场打翻茶杯,声望,95,你救了皇上的名声。,"圣宠+80;声望+50",你被皇上当众处死以灭口。,"死亡",神不知鬼不觉换掉,心机,90,你做到了完美替圣上分忧。,"心机+80;圣宠+50",被臣子发现你在换茶，当场抓获。,"死亡",0
2086,日常,宫中绘画,你在画一幅《百鸟朝凤》。,画得栩栩如生,才情,85,皇后将其挂在寝宫，你地位稳固。,"才情+30;声望+20",你把凤凰画得像野鸡。,"声望-20",加入皇帝的背影,心机,80,皇上看到后非常感动。,"圣宠+60;才情+10",皇上觉得你亵渎龙颜。,"圣宠-40",0
2087,机遇,冬至包饺子,全宫一起过节，你包的饺子里藏了金币。,皇上正好吃到了,心机,75,皇上赞你是福星。,"圣宠+50;声望+20",皇上险些崩了牙。,"圣宠-40",自己吃到了金币,体质,60,你感觉明年会有好运气。,"体质+15",你差点被噎死。,"体质-30",0
2088,日常,整理旧衣,你在整理旧衣服时发现了一个旧钱袋。,将其交给管事,声望,70,你得到了诚实的美名。,"声望+20",管事觉得你在装模作样。,"声望-10",私自收起备用,心机,65,你多了一笔活动经费。,"心机+15",被发现私藏财物。,"体质-20;声望-10",0
2089,机遇,皇子满月,你在满月礼上被要求唱一首摇篮曲。,唱得婉转动人,才情,80,全场听得入迷。,"才情+20;圣宠+40",你唱破了音，引来大笑。,"声望-25",加入家乡的小调,心机,75,皇上觉得新鲜。,"心机+20;圣宠+30",皇上觉得曲调土气。,"圣宠-10",1
2090,死局,刺客突袭,晚宴上，一名舞姬突然拔剑刺向皇上。,用身体挡住利剑,体质,90,你救了皇上的命，直接晋升贵妃。,"圣宠+200;声望+150",你被一剑封喉。,"死亡",掷出手中金杯击偏,心机,95,你救了驾且毫发无伤。,"心机+60;圣宠+80",你没击中，皇上受伤，你被治罪。,"死亡",1
2091,博弈,被诬偷窃,皇后丢失了心爱的东珠，有人指认在你宫中见过。,主动请求彻底搜查,心机,90,你早已将赃物反向栽赃给陷害你的人，当众揭穿。,"心机+40;声望+20",你没发现床底被塞了东西，被当场抓获。,"死亡",以病弱之躯博同情,容貌,85,皇上见你面色苍白不似作伪，下令严查举报者。,"圣宠+40;容貌+5",皇后认为你装模作样，罚跪慎刑司。,"体质-50;声望-30",0
2092,日常,宫中棋局,你在御花园凉亭见到一盘未完的残局，皇上正皱眉沉思。,巧妙落下一子,才情,90,皇上豁然开朗，大赞你是他的“女诸葛”。,"才情+40;圣宠+50",你乱下棋子导致局面全毁，皇上大怒。,"圣宠-20",为皇上换一杯新茶,心机,75,你贴心的举动让皇上感到一丝宁静。,"心机+15;圣宠+25",茶水太烫，惊扰了圣驾。,"体质-10",0
2093,机遇,冷宫救人,冷宫处传来呼救声，似乎是某位曾经得宠的废妃大病。,带太医前去诊治,声望,85,她康复后送你一份后宫秘密名单作为报答。,"心机+50;声望+30",你被指私通废妃，受了牵连。,"声望-40",置之不理离开,心机,80,你成功避开了一个针对你的圈套。,"心机+25",你被路过的宫女指责刻薄寡恩。,"声望-20",0
2094,日常,练习插花,太后举办插花会，要求各宫小主展现品味。,以枯木逢春为题,才情,85,太后赞你意境高远，赏了你一件佛宝。,"才情+30;声望+20",太后觉得你选材晦气，不喜。,"声望-15",选用大红大紫,容貌,80,你虽然俗气但也显得富贵吉祥。,"容貌+15;声望+10",皇上觉得你俗不可耐。,"圣宠-15",0
2095,死局,皇帝醉酒,皇上在偏殿喝得酩酊大醉，嘴里喊着别人的名字。,温柔上前顶替,心机,95,你成功让皇上把你当成了心上人，百般宠爱。,"圣宠+100;心机+30",皇上酒醒发现是你，觉得被愚弄。,"死亡",悄然退下避祸,声望,85,你守住了名声，没留下任何把柄。,"声望+20",你被大太监责备伺候不力，扣了月钱。,"声望-15",1
2096,博弈,内廷流言,有人传言你家父在朝中贪污，皇上近日对你冷淡。,写信回乡求证,心机,85,你拿到了澄清的证据，反击了流言。,"心机+30;声望+20",家信被截，被指内外勾结。,"死亡",在雪地跪求信任,体质,90,皇上被你的坚持打动，下令彻查。,"圣宠+60;体质-40",你冻晕过去，皇上依旧没理你。,"体质-50;圣宠-20",0
2097,机遇,御园春猎,皇上在园中射中一只白狐，问你如何处理。,请求放生积德,声望,80,皇上赞你心地纯良，称你为“仁妃”。,"声望+40;圣宠+30",皇上觉得你假慈悲。,"圣宠-15",请求制成围脖,容貌,85,皇上赞你娇俏动人，亲自为你围上。,"容貌+20;圣宠+40",你被动物保护组织（太后）责备残忍。,"声望-30",0
2098,日常,学习琴技,你为了侍寝，特意向琴师请教高难度曲目。,苦练指法磨出血,体质,80,你的技艺突飞猛进，圣宠指日可待。,"才情+35;体质-10",你的手受了重伤，半年不能弹琴。,"体质-30;才情-10",加入独特韵律,才情,85,皇上听完曲子，惊叹你的灵气。,"才情+40;圣宠+30",曲调过于怪异。,"圣宠-10",1
2099,博弈,新晋之争,一个刚入宫的新人不仅截了你的胡，还嘲讽你年华已逝。,暗中送去毁容药,心机,90,你神不知鬼不觉地除掉了竞争对手。,"心机+60",被对方反将一计，你成了凶手。,"死亡",提升自身容貌,容貌,95,你一番打扮，生生将新人比了下去。,"容貌+40;圣宠+40",你打扮得过于招摇，被皇上斥责。,"圣宠-30",1
2100,死局,谋刺惊魂,深夜有黑衣人闯入你寝宫，逼问皇上的行踪。,指错方向误导,心机,95,你成功引开了刺客并报警，救了驾。,"圣宠+150;声望+100",刺客识破了谎言，当场取你性命。,"死亡",宁死不屈反抗,体质,90,你拖延了时间，侍卫赶到救了你。,"圣宠+120;声望+80",你被刺客一刀了结。,"死亡",0
2101,机遇,圣驾临门,皇上突然造访，见你在灯下缝补旧衣。,表示生活节俭,声望,80,皇上赞你有勤俭持家之德。,"声望+30;圣宠+40",皇上觉得你太寒酸，丢了他的脸。,"圣宠-20",说是思念母妃,心机,85,皇上感同身受，对你大加抚慰。,"圣宠+50;心机+20",皇上嫌你多愁善感。,"圣宠-15",1
2102,日常,整理卷轴,你在御书房整理前朝地图。,发现防务漏洞,才情,95,你向皇上建言，皇上对你刮目相看。,"才情+50;圣宠+80",皇上觉得你干预国政，大忌。,"死亡",整理得井井有条,心机,75,你得到了皇上的赏赐。,"声望+20;心机+10",你弄乱了绝密档案。,"声望-30",0
2103,博弈,姐妹站队,两位高位妃子正在争夺协理六宫之权，都要你表态。,两不相帮中立,心机,90,你在这场风波中独善其身。,"心机+40",你被两边同时视为眼中钉。,"声望-30",选强者依附,声望,85,你得到了暂时的地位加持。,"声望+30;心机+10",对方失势，你被一起清算。,"死亡",0
2104,日常,练习书法,你在宣纸上反复书写皇上的名字。,不小心被皇上撞见,容貌,85,皇上见你满纸皆是他，感动不已。,"圣宠+60;容貌+10",皇上觉得你在施展媚术诅咒。,"圣宠-30",赶紧撕碎藏起,心机,80,你掩盖了羞涩的心思。,"心机+15",皇上觉得你有事隐瞒，起了疑心。,"圣宠-20",1
2105,机遇,夏日赏冰,内务府送来了极其罕见的西域冰果。,分给其他嫔妃,声望,85,你的谦逊赢得了全宫的赞誉。,"声望+40;心机+10",别人吃了闹肚子，全赖在你头上。,"声望-50",亲自喂给皇上,容貌,90,皇上吃得开心，今夜留宿。,"圣宠+70;容貌+15",皇上嫌冰得牙疼，败兴。,"圣宠-20",1
2106,日常,刺绣屏风,你要绣一副巨型的万里江山图。,昼夜不分赶工,体质,85,屏风气势宏大，皇上将其置于金銮殿。,"声望+50;圣宠+40",你累得眼睛酸涩，看东西模糊。,"容貌-20;体质-30",加入家乡绣法,才情,90,皇上赞叹绣法独到，别具一格。,"才情+40;圣宠+30",主子嫌你破坏了规矩。,"声望-20",0
2107,博弈,御膳夺爱,皇上赏赐的一道名菜，被路过的贵妃强行带走。,委屈隐忍不言,心机,85,皇上知道后，觉得你懂事，加倍补偿。,"圣宠+60;心机+20",你被认为软弱，从此待遇更差。,"声望-30",当面据理力争,声望,90,你保住了尊严，但也彻底得罪了贵妃。,"声望+40",贵妃当众掌嘴你二十。,"体质-20;容貌-10",0
2108,死局,鸩酒疑云,皇上命你给落马的重臣之女（你的好友）送去毒酒。,偷偷换成假死药,心机,90,你救了好友且未被发现，成就一段义举。,"心机+80;声望+50",药效过慢被发现，你被灭口。,"死亡",硬着头皮送去,声望,90,你完成了任务，但内心永远难安。,"声望+20;心机-30",你被对方拼死反击，同归于尽。,"死亡",0
2109,日常,御花园观鱼,你在池边喂鱼，皇上突然从身后抱住你。,惊喜转头迎接,容貌,90,你的笑靥让皇上心驰神往。,"圣宠+70;容貌+20",你吓得把鱼食洒了皇上一脸。,"圣宠-40",反手推开惊叫,体质,75,皇上觉得你真实可爱，毫不做作。,"圣宠+30",皇上觉得你冲撞圣躬。,"圣宠-20",1
2110,机遇,皇帝噩梦,皇上在梦中大喊“杀贼”，醒来时情绪失控。,紧紧抱住他安慰,容貌,95,你成了帝王软弱时唯一的港湾。,"圣宠+120;容貌+20",皇上在混乱中掐住了你的脖子。,"死亡",跪在床头读佛经,才情,90,皇上逐渐在经声中平静下来。,"才情+40;圣宠+50",皇上嫌你吵闹，让你滚。,"圣宠-30",1
2111,日常,研磨香料,你尝试调配一种能让人身心愉悦的熏香。,加入珍贵沉香,心机,85,皇上在你宫里总能睡得极好，天天来。,"圣宠+80;心机+20",香料过重，皇上闻了头晕。,"圣宠-30",送给太后助眠,声望,80,太后对你大加赞赏，成了你的靠山。,"声望+50;心机+20",太后觉得你在香里下药害她。,"死亡",0
2112,博弈,降位危机,你被指控在宫宴上使用了逾制的外袍。,指认内务府送错,心机,90,你成功摆脱嫌疑，内务府管事成了替罪羊。,"心机+40;声望+20",管事拿出你的贿赂证据。,"死亡",直接跪地认错,声望,85,皇上见你态度诚恳，免了处罚。,"圣宠+10;声望-10",皇上大怒，降你为宫女。,"死亡",0
2113,机遇,春日蹴鞠,后宫举办蹴鞠大赛，皇上在台下观看。,展示惊人球技,体质,90,你矫健的身姿让皇上赞不绝口。,"圣宠+60;体质+20",你摔了个狗啃泥，全宫大笑。,"声望-40;容貌-10",在场边加油鼓劲,容貌,80,你美得像一幅画，皇上只顾着看你。,"圣宠+40;容貌+10",皇上觉得你没参与感。,"声望-10",0
2114,日常,修补孤本,皇上心爱的古籍散架了，没人敢动。,用祖传技法修补,才情,95,皇上大喜，称你为“兰心蕙质”。,"才情+50;圣宠+60",你不小心弄丢了一页。,"死亡",建议皇上重新誊抄,心机,75,皇上觉得你有自知之明。,"心机+15",皇上觉得你懒惰不肯出力。,"圣宠-20",0
2115,博弈,嫔妃投毒,你发现你的茶杯边沿有淡淡的苦味。,将计就计喝下装死,心机,95,皇上震怒下令严查，凶手伏法。,"圣宠+100;心机+40",你药量没算准，真的中毒太深。,"死亡",立刻打碎茶杯反击,声望,85,你保护了自己，但没抓到真凶。,"声望+20",你被指责在御前失仪，毁坏御赐之物。,"圣宠-30",0
2116,日常,宫中礼仪,太后突击检查各位小主的行走坐卧。,展示最标准的步伐,声望,90,太后赞你有名门风范，赏了金钗。,"声望+40;容貌+10",你太紧张左脚踩右脚。,"声望-20",亲手奉上养生茶,心机,80,太后被你哄得很开心。,"心机+25;声望+20",太后觉得你在谄媚。,"声望-15",0
2117,机遇,皇帝出巡,皇上准备去江南巡游，名单上没有你。,深夜潜入龙舟祈求,容貌,95,皇上被你的痴情打动，带你上船。,"圣宠+100;体质-20",你被侍卫当成刺客抓获。,"死亡",送上亲制的江南图,才情,90,皇上见图思人，补加了你的名字。,"才情+40;圣宠+50",皇上觉得你多此一举。,"声望-20",1
2118,死局,巫蛊咒物,你在对手床底发现了她诅咒皇后的木偶。,直接向皇上告发,声望,90,你成功铲除了劲敌，获得赏赐。,"声望+60;圣宠+40",由于证据不足，你被反咬一口。,"死亡",偷偷拿走自己藏起来,心机,90,你掌握了对方一辈子的死穴。,"心机+80",你被对手的眼线当场抓住。,"死亡",0
2119,日常,种植牡丹,你在园中培育出一朵罕见的蓝色牡丹。,献给太后寿辰,声望,95,太后大喜，直接封你为贵人。,"声望+100;圣宠+50",花在寿宴上突然枯萎。,"死亡",请皇上共同赏花,容貌,85,皇上觉得花美，人更美。,"圣宠+50;容貌+10",皇上对花粉过敏。,"圣宠-50",1
2120,机遇,边疆捷报,皇上因前方大胜心情极好，在御花园设宴。,即兴创作祝捷诗,才情,95,皇上引为奇才，当众赏赐你。,"才情+50;圣宠+80",你诗中用词不当，被指影射战亡将领。,"死亡",频频举杯贺皇上,体质,85,皇上觉得你与他同喜，非常痛快。,"圣宠+50;体质-20",你喝醉了，御前失仪。,"圣宠-30",1
2121,博弈,位分僭越,一个贵人用了本该属于嫔位的明黄色丝绸。,当众指出其错误,声望,90,你维护了宫廷法度，受皇后赞赏。,"声望+50;心机+10",对方家世显赫，反让你下不来台。,"声望-40",私下提醒她换掉,心机,85,她对你感激涕零，成了你的盟友。,"心机+30;声望+20",她觉得你在威胁她，怀恨在心。,"心机-20",0
2122,日常,整理内务,你在整理旧物时发现了一张不知名的遗诏。,交给皇上处置,心机,90,你立下救驾奇功。,"圣宠+150;心机+50",你被皇上灭口。,"死亡",立刻烧掉装不知道,声望,90,你躲过了一劫。,"心机+40",纸灰被发现，你被审问。,"死亡",0
2123,机遇,月下独舞,月光如银，你在太液池边翩翩起舞。,舞姿曼妙绝伦,容貌,95,皇上在远处看得痴迷，当晚留宿。,"容貌+40;圣宠+100",你失足跌入湖中。,"体质-30;容貌-10",加入武术招式,体质,90,皇上赞你巾帼豪情。,"圣宠+60;体质+20",皇上觉得你太粗鲁。,"圣宠-20",1
2124,日常,抄写佛经,你被派去为死去的妃子抄经七日。,虔诚斋戒抄写,体质,85,皇上感念你仁厚。,"圣宠+40;声望+30",你累得晕倒在佛堂。,"体质-40",找人代笔抄写,心机,80,你成功偷懒。,"心机+20",被发现对死者不敬，罚去冷宫。,"死亡",0
2125,机遇,圣驾不适,皇上批阅奏章时眼睛干涩。,上前轻柔按摩,体质,90,皇上觉得你手法极佳。,"圣宠+50;体质-10",你手劲太大，按疼了皇上。,"圣宠-20",送上明目药膳,心机,85,皇上觉得你贴心。,"圣宠+40;心机+15",药膳太苦，皇上不爱。,"圣宠-15",1
2126,博弈,嫔妃生子,你的对手生下了皇子，圣宠正浓。,送去祝福贺礼,声望,85,你展现了大度。,"声望+30;心机+10",礼品被指含有让婴儿过敏的东西。,"死亡",暗中观察动向,心机,90,你发现了对方产子的隐情。,"心机+50",你被对方灭口。,"死亡",0
2127,日常,练习歌技,你在深夜对着宫墙唱歌。,唱法空灵高远,才情,95,皇上以为遇到了仙女降世。,"才情+50;圣宠+80",你被邻居指责扰民。,"声望-20",唱家乡的童谣,容貌,85,皇上想起了小时候，对你心生爱怜。,"圣宠+50;容貌+10",皇上觉得你没品味。,"圣宠-20",1
2128,死局,谋朝篡位,有朝臣密谋造反，想利用你给皇上下药。,假意答应并举报,心机,90,你救了江山社稷，直升贵妃。,"圣宠+200;声望+200",举报计划泄露，你被反贼先杀。,"死亡",断然拒绝被囚,声望,95,你保持了节操。,"声望+100",你被反贼直接灭口。,"死亡",0
2129,日常,整理御花园,你在园中修剪花木。,修剪出绝美造型,才情,90,皇上赞你有艺术天分。,"才情+30;圣宠+30",你不小心剪掉了皇上最爱的兰花。,"死亡",顺手采集朝露,心机,80,你为皇上泡了一杯灵动之茶。,"心机+20;圣宠+40",你被蚊子咬得满脸包。,"容貌-15",1
2130,机遇,皇上微服,皇上穿便装在宫外游玩归来，带了民间小吃。,表现得极其惊喜,心机,85,皇上觉得你没心机，很真实。,"圣宠+50;心机+10",皇上觉得你没见过世面。,"声望-15",劝皇上注意龙体,声望,90,皇上觉得你很贤惠。,"声望+40;圣宠+30",皇上觉得你扫兴。,"圣宠-40",1
2131,机遇,圣驾避雨,雷雨交加，皇上恰好路过你宫门口，进来避雨。,煮一壶姜茶暖身,心机,85,皇上在风雨中感受到了久违的家常温暖。,"圣宠+45;心机+15",姜茶太辣，皇上喝了一口便皱眉。,"圣宠-10",素手执伞相送,容貌,90,你雨中撑伞的倩影，成了皇上心中的画作。,"圣宠+60;容貌+10",你脚下滑倒，不仅自己摔了还带倒了皇上。,"体质-30;圣宠-50",1
2132,日常,临摹古画,你正在临摹一幅早已失传的《洛神图》。,加入自己的神韵,才情,95,皇上赞你笔下的洛神竟有几分你的影子。,"才情+40;圣宠+50",你把洛神画得过于妖艳，被指不端。,"声望-20",请皇上共同补笔,圣宠,90,两人共执一笔，情意绵绵。,"圣宠+80;才情+20",皇上嫌你画技太差，弄脏了他的御笔。,"圣宠-30",1
2133,博弈,被诬下毒,内务府分发的胭脂中混入了毁人容貌的毒药，且指向是你所为。,亲自试药自证,体质,90,你拼死吃下自证清白，皇上心疼不已，厚赐于你。,"圣宠+120;体质-40",你中毒太深，容颜尽毁且性命堪忧。,"死亡",分析药粉来源,心机,95,你通过药粉中独特的西域香气揪出了真凶。,"心机+50;声望+40",你被对方灭口，做成自裁假象。,"死亡",0
2134,日常,御花园摘花,你在采摘朝露时，遇到皇上正在怀念早逝的宠妃。,轻声吟诵安魂曲,才情,90,皇上在你的歌声中得到了真正的平静。,"才情+30;圣宠+50",皇上觉得你冒犯了故人。,"圣宠-40",默默跪在身后陪伴,声望,85,皇上转身看到你，心中泛起一丝温情。,"圣宠+35;声望+20",皇上觉得你碍眼，命你滚。,"圣宠-20",1
2135,死局,谋逆惊魂,你无意间在冷宫角落听到了大将军与内侍的谋反密谈。,立刻寻找禁卫军,体质,95,你飞奔报信阻止了宫变，立下盖世奇功。,"圣宠+200;声望+150",你在奔跑途中被乱箭射死。,"死亡",躲在暗处记下名单,心机,90,你掌握了足以动摇朝局的绝密名录。,"心机+80",你踩到枯枝发出响声，被当场灭口。,"死亡",0
2136,日常,宫中礼仪,太后突击检查各位小主的刺绣功底。,绣出一幅百鸟朝凤,才情,95,太后赞你技艺无双，赐你协理内务。,"声望+80;才情+40",你因紧张绣断了金线。,"声望-30",绣出一尊慈悲观音,心机,90,太后见你佛心虔诚，对你大加赞赏。,"声望+60;心机+30",太后觉得你虚伪。,"声望-20",0
