剧情ID,剧情类型,标题,正文,选项1,选项1判定属性,选项1门槛,选项1成功文案,选项1成功效果,选项1失败文案,选项1失败效果,选项2,选项2判定属性,选项2门槛,选项2成功文案,选项2成功效果,选项2失败文案,选项2失败效果,是否侍寝
2137,机遇,皇帝生辰,皇上寿宴，各宫争奇斗艳。,表演惊鸿剑舞,体质,90,你英气勃发，皇上当众赏你夜明珠。,"圣宠+100;体质+20",剑尖划破了舞池的地毯，被治失仪。,"声望-40",献上万寿无疆酒,心机,85,酒中加入了你特制的药膳，皇上龙精虎猛。,"圣宠+60;心机+20",酒里被对手下药，你成了弑君凶手。,"死亡",1
2138,日常,整理旧档案,你在卷宗里发现了一个关于皇上生母的惊天秘密。,将秘密带入棺材,心机,90,你因沉稳不言，反而得到了皇上的终身信任。,"心机+100;声望+20",你神情恍惚被皇上看出，由于知道太多被处死。,"死亡",利用秘密威胁对手,心机,90,你成功除掉了心腹大患。,"心机+60",对方拼死告发你窥探禁中秘事。,"死亡",0
2139,博弈,嫔妃联手,几名得宠的妃子联手排挤你，扣下了你的炭火。,去御花园冻伤偶遇,容貌,95,皇上见你冻得瑟瑟发抖，心碎之下严惩凶手。,"圣宠+80;容貌-10",你真的冻出了大病，且皇上根本没经过。,"体质-60",用最后的银子贿赂,心机,90,你拿回了炭火并反向收买了对方的人。,"心机+40",你变得一贫如洗。,"声望-20",0
2140,机遇,春日蹴鞠,皇上兴致大发，要你下场踢球。,展示惊人身法,体质,95,皇上被你的活力感染，连连叫好。,"圣宠+70;体质+30",你一球踢到了皇上脸上。,"死亡",在一旁巧妙解说,才情,90,皇上赞你谈吐风雅。,"才情+30;圣宠+30",皇上嫌你话多。,"圣宠-10",0
2141,日常,研习香道,你在调制一种名为“思帝乡”的奇香。,加入西域返魂香,心机,90,皇上闻到此香便如入幻境，唯你是从。,"圣宠+120;心机+30",皇上对香气过敏，引发旧疾。,"死亡",调制清淡冷香,容貌,90,皇上赞你气质清冷，不染尘埃。,"圣宠+50;容貌+20",皇上觉得这香味太索然无味。,"圣宠-20",1
2142,博弈,位分僭越,一个新入宫的常在穿着只有贵人才能用的正红色。,当场严厉训诫,声望,90,你维护了宫规，太后赞你稳重。,"声望+80;心机+20",对方后台极硬，你反被扣上欺压新人的帽子。,"声望-50",暗中剪坏她的衣服,心机,95,她在宴会上当众丢丑，被贬为庶人。,"心机+50",你被当场抓获。,"死亡",0
2143,机遇,圣上微恙,皇上偶感风寒，太医们都束手无策。,献上民间土方,心机,90,皇上服下后奇迹般痊愈。,"圣宠+100;声望+50",药不对症，皇上病情加重，你被治罪。,"死亡",衣不解带守候三日,体质,90,皇上醒来见到你的憔悴，深感你之赤诚。,"圣宠+80;体质-50",你累死在病榻前。,"死亡",1
2144,日常,修补孤本,皇上最爱的《诗经》残页被你意外修复。,恢复古籍原貌,才情,95,皇上引你为唯一的“知音”。,"圣宠+150;才情+60",你不小心弄花了古人的真迹。,"死亡",加入自己的批注,才情,90,你的见解让皇上醍醐灌顶。,"圣宠+100;才情+80",皇上觉得你狂妄自大。,"圣宠-50",1
2145,死局,后宫失火,你的寝宫突然起火，且门被反锁了。,拼死从狗洞爬出,体质,90,你虽狼狈但保住了性命，发现是人为放火。,"体质-30;心机+40",你被浓烟呛死。,"死亡",在大火中弹琴求救,才情,90,皇上被琴声吸引亲自冲入火海救你。,"圣宠+200;声望+100",你被活活烧死。,"死亡",1
2146,机遇,皇子哭闹,小皇子百日宴上大哭不止，众妃束手无策。,用草药香囊安神,心机,90,皇子瞬间止哭微笑，皇后对你感激不尽。,"声望+100;圣宠+50",皇子对草药过敏。,"死亡",唱起家乡的童谣,才情,95,皇子在你怀中睡着。,"圣宠+80;声望+40",你被嫌弃歌声太土。,"声望-30",0
2147,博弈,圣宠分配,皇上连坐了你三晚，引起了满宫嫉妒。,主动劝皇上去别处,心机,90,皇上赞你贤德，反而更离不开你。,"圣宠+150;声望+50",皇上真的走了，且很久没再回来。,"圣宠-100",霸占圣驾不放,容貌,95,你成了宫中唯一的宠妃。,"圣宠+200;容貌+30",你被太后以“妖妃”之名杖毙。,"死亡",1
2148,日常,整理御园,你在园中发现了一处极其适合避暑的凉亭。,引皇上前去消暑,心机,95,皇上赞你会享受，在此留宿数日。,"圣宠+80;心机+20",皇上在亭子里被毒虫叮咬。,"圣宠-50",自己私下享受,体质,85,你度过了一个愉快的夏天。,"体质+30",你被指责私占御园。,"声望-20",0
2149,机遇,月下论道,皇上最近迷上了炼丹求长生。,劝皇上珍重御体,声望,90,皇上听从了你的逆耳忠言，封你为贤妃。,"声望+150;圣宠+50",皇上觉得你阻碍他成仙，当场赐死。,"死亡",亲自学习炼丹陪伴,心机,90,你成了皇上求仙路上的唯一道友。,"圣宠+100;心机+50",你因为误食铅汞重金属中毒。,"体质-80;容貌-30",1
2150,机遇,边疆动乱,皇上因前方战败大发雷霆，欲亲征。,请求随军侍奉,体质,90,皇上赞你有胆识，带你体验塞外风光。,"圣宠+150;体质-50",你被皇上觉得是在添乱。,"圣宠-40",作画讽刺敌军,才情,95,皇上见画大笑，压力全消。,"才情+50;圣宠+80",画作落入敌手，被指通敌。,"死亡",1
2151,日常,种植药草,你在后院种下了一些能延年益寿的灵芝。,献给皇上服用,声望,95,皇上神清气爽，直接晋你为贵人。,"圣宠+100;声望+100",皇上吃完上火流鼻血。,"圣宠-30",留着自己服用,体质,90,你感觉年轻了十岁。,"体质+50;容貌+20",药性太猛。,"体质-20",0
2152,博弈,太后生辰,你需要准备一份最特别的贺礼。,抄写万福图,才情,90,太后将其挂在佛堂。,"声望+80;才情+40",你写错了福字。,"声望-50",亲自排演祝寿舞,容貌,90,皇上在宴上对你惊为天人。,"圣宠+120;容貌+40",你跳舞时踩到了裙摆。,"声望-30",0
2153,机遇,皇帝噩梦,皇上梦见山河破碎，惊醒后痛哭。,温柔抱住并共绘江山,才情,95,皇上在你身上找到了重建山河的力量。,"圣宠+200;心机+50",皇上觉得你窥探他的恐惧。,"死亡",跪地请求分担忧愁,声望,90,皇上觉得你很体贴。,"声望+50;圣宠+40",皇上让你走开。,"圣宠-20",1
2154,日常,修剪花木,你正在修剪皇上最爱的墨兰。,修剪出孤高之感,才情,90,皇上赞你有君子之风。,"圣宠+60;才情+30",兰花被你剪死了。,"死亡",将落叶收集制茶,心机,90,皇上喝到了最醇厚的兰花香。,"心机+30;圣宠+50",皇上闹肚子。,"体质-20",1
2155,死局,鸩酒之灾,你被诬陷私通，皇上将鸩酒放在你面前。,平静喝下并致辞,心机,90,皇上最后一刻察觉你是被冤枉的，紧紧抱住你。,"圣宠+300;声望+100",你真的死了。,"死亡",指认现场疑点,心机,95,你冷静的头脑救了你的命。,"心机+80;声望+50",皇上已经疯魔，不听解释。,"死亡",0
2156,机遇,秋夜观星,你在夜空下为皇上讲解牛郎织女。,借星象隐喻情深,才情,95,皇上发誓绝不负你。,"圣宠+150;才情+40",皇上觉得你是在要位分。,"圣宠-30",展示自制的浑天仪,心机,90,皇上惊叹你的博学。,"心机+50;圣宠+80",浑天仪炸了。,"体质-30",1
2157,日常,刺绣龙旗,皇上亲征前要你绣一杆帅旗。,用自己的头发绣入,心机,95,皇上带着帅旗所向披靡，称你是他的守护神。,"圣宠+200;声望+100",你被指控下蛊。,"死亡",追求极致美感,才情,90,帅旗成了艺术品。,"声望+50;才情+40",你因劳累双目失明。,"容貌-50;体质-50",0
2158,博弈,新人截胡,一个新来的答应抢走了皇上本该去你那里的轿辇。,拦住圣驾告状,声望,90,皇上惩罚了新人，亲自牵你回宫。,"圣宠+100;声望+50",皇上觉得你心胸狭窄。,"圣宠-60",在必经之路弹琴,才情,95,皇上中途下轿，弃她而来。,"圣宠+120;心机+40",琴声太凄凉，皇上加速离开。,"圣宠-30",1
2159,机遇,岁末分封,皇上要在跨年之夜晋升一名嫔妃。,展示一年来的功绩,声望,90,你名至实归，直接封为贵人。,"圣宠+100;声望+200",皇上觉得你太功利。,"声望-50",陪伴皇上守岁不求名分,容貌,90,皇上感动于你的淡泊，额外加封。,"圣宠+150;容貌+20",你睡着了。,"圣宠-10",1
